{
  "$schema": "https://json-schema.org/draft/2020-12/schema",
  "title": "aft_search quality slice descriptor",
  "type": "object",
  "required": ["slice_class", "targeted_mechanism", "kind", "fixtures"],
  "properties": {
    "slice_class": {"enum": ["ranking", "non_ranking", "engine_unwired"], "description": "Declaration checked against the diff-derived class; engine_unwired is allowed only for ranking diffs that prove byte-identical behavior."},
    "targeted_mechanism": {"type": "string"},
    "kind": {"enum": ["ranking", "readiness", "paging", "confidence", "harness"]},
    "fixtures": {"type": "array", "minItems": 1, "items": {"type": "string"}},
    "slices": {"type": "array", "minItems": 1, "items": {"type": "string"}}
  },
  "ranking_fence_prefixes": [
    "crates/aft/src/commands/semantic_search.rs",
    "crates/aft/src/commands/semantic_search/",
    "crates/aft/src/search_index.rs",
    "crates/aft/src/query_shape.rs",
    "crates/aft/src/semantic_index.rs",
    "crates/aft/src/embed/",
    "crates/aft/src/lib.rs",
    "packages/pi-plugin/",
    "packages/opencode-plugin/",
    "benchmarks/aft-search/engine-fixtures/"
  ]
}
